{
  "schema_version": 1,
  "generatedAt": "2026-04-16T00:00:00.000Z",
  "projects": [
    {
      "id": "systalk-adminhub",
      "projectType": "company",
      "i18nNamespace": "portfolio.projects",
      "link": null,
      "technologies": [
        { "name": "Angular", "icon": "AngularIcon", "category": "前端框架" },
        { "name": "TypeScript", "icon": "TypeScriptIcon", "category": "程式語言" },
        { "name": "TailwindCSS", "icon": "TailWindIcon", "category": "CSS 框架" },
        { "name": "Ngrx", "icon": "NgrxIcon", "category": "狀態管理" },
        { "name": "RxJS", "icon": "RxJSIcon", "category": "響應式程式" },
        { "name": "Docker", "icon": "DockerIcon", "category": "容器化" },
        { "name": "ESLint", "icon": "ESLintIcon", "category": "代碼品質" },
        { "name": "Prettier", "icon": "PrettierIcon", "category": "代碼格式化" }
      ],
      "screenshots": [],
      "displayOrder": 0,
      "isPublished": true
    },
    {
      "id": "systalk-audit",
      "projectType": "company",
      "i18nNamespace": "portfolio.projects",
      "link": null,
      "technologies": [
        { "name": "Angular", "icon": "AngularIcon", "category": "前端框架" },
        { "name": "TypeScript", "icon": "TypeScriptIcon", "category": "程式語言" },
        { "name": "TailwindCSS", "icon": "TailWindIcon", "category": "CSS 框架" },
        { "name": "Ngrx", "icon": "NgrxIcon", "category": "狀態管理" },
        { "name": "RxJS", "icon": "RxJSIcon", "category": "響應式程式" },
        { "name": "Docker", "icon": "DockerIcon", "category": "容器化" },
        { "name": "Echart", "icon": "EchartIcon", "category": "圖表視覺化" }
      ],
      "screenshots": [],
      "displayOrder": 1,
      "isPublished": true
    },
    {
      "id": "systalk-global-life-icr",
      "projectType": "company",
      "i18nNamespace": "portfolio.projects",
      "link": null,
      "technologies": [
        { "name": "Angular", "icon": "AngularIcon", "category": "前端框架" },
        { "name": "TypeScript", "icon": "TypeScriptIcon", "category": "程式語言" },
        { "name": "TailwindCSS", "icon": "TailWindIcon", "category": "CSS 框架" },
        { "name": "RxJS", "icon": "RxJSIcon", "category": "響應式程式" }
      ],
      "screenshots": [],
      "displayOrder": 2,
      "isPublished": true
    },
    {
      "id": "travel-planner",
      "projectType": "personal",
      "i18nNamespace": "portfolio.projects",
      "link": null,
      "technologies": [
        { "name": "Next.js 16", "icon": "NextJSIcon", "category": "前端框架" },
        { "name": "React 19", "icon": "ReactIcon", "category": "前端框架" },
        { "name": "TypeScript", "icon": "TypeScriptIcon", "category": "程式語言" },
        { "name": "Redux Toolkit", "icon": "ReduxIcon", "category": "狀態管理" },
        { "name": "Zustand", "icon": "ZustandIcon", "category": "狀態管理" },
        { "name": "TailwindCSS", "icon": "TailWindIcon", "category": "CSS 框架" },
        { "name": "Radix UI", "icon": "RadixIcon", "category": "UI 組件庫" },
        { "name": "Shadcn", "icon": "ShadcnIcon", "category": "UI 組件庫" },
        { "name": "Google Maps API", "icon": "GoogleMapsIcon", "category": "地圖服務" },
        { "name": "DND Kit", "icon": "DndKitIcon", "category": "拖拽交互" },
        { "name": "Lucide Icons", "icon": "LucideIcon", "category": "圖標庫" },
        { "name": "Sonner", "icon": "SonnerIcon", "category": "通知系統" },
        { "name": "Docker", "icon": "DockerIcon", "category": "容器化" },
        { "name": "ESLint", "icon": "ESLintIcon", "category": "代碼品質" },
        { "name": "Prettier", "icon": "PrettierIcon", "category": "代碼格式化" }
      ],
      "screenshots": [],
      "displayOrder": 0,
      "isPublished": true
    },
    {
      "id": "gxcella",
      "projectType": "personal",
      "i18nNamespace": "portfolio.projects",
      "link": null,
      "technologies": [
        { "name": "Angular 20", "icon": "AngularIcon", "category": "前端框架" },
        { "name": "TypeScript", "icon": "TypeScriptIcon", "category": "程式語言" },
        { "name": "TailwindCSS", "icon": "TailWindIcon", "category": "CSS 框架" },
        { "name": "Lucide Angular", "icon": "LucideIcon", "category": "圖標庫" },
        { "name": "ng-packagr", "icon": "NgPackagrIcon", "category": "建置工具" },
        { "name": "Changesets", "icon": "ChangesetsIcon", "category": "版本管理" },
        { "name": "npm Workspaces", "icon": "NpmIcon", "category": "Monorepo 管理" },
        { "name": "RxJS", "icon": "RxJSIcon", "category": "響應式程式" },
        { "name": "Jasmine", "icon": "JasmineIcon", "category": "測試框架" },
        { "name": "ESLint", "icon": "ESLintIcon", "category": "代碼品質" },
        { "name": "Prettier", "icon": "PrettierIcon", "category": "代碼格式化" }
      ],
      "screenshots": [],
      "displayOrder": 1,
      "isPublished": true
    }
  ],
  "version": 1
}
